{
  "pageId": "welcome",
  "tenantId": "acme",
  "templateId": "template.two-column",
  "templateVersion": "0.1.0",
  "regions": {
    "main": [
      {
        "widgetId": "content.announcements",
        "instanceId": "w-welcome-main-1",
        "config": {
          "mode": "text",
          "text": "Welcome to Atlas."
        }
      }
    ],
    "sidebar": []
  },
  "status": "published",
  "meta": {
    "title": "Welcome",
    "slug": "/welcome"
  }
}
