{
  "pageId": "gallery-dashboard-tiles",
  "tenantId": "acme",
  "templateId": "template.dashboard-tiles",
  "templateVersion": "0.1.0",
  "regions": {
    "tiles": [
      {
        "widgetId": "content.announcements",
        "instanceId": "w-gdt-tile-1",
        "config": { "mode": "text", "text": "Tile 1 — metric or status." }
      },
      {
        "widgetId": "content.announcements",
        "instanceId": "w-gdt-tile-2",
        "config": { "mode": "text", "text": "Tile 2 — metric or status." }
      },
      {
        "widgetId": "content.announcements",
        "instanceId": "w-gdt-tile-3",
        "config": { "mode": "text", "text": "Tile 3 — metric or status." }
      },
      {
        "widgetId": "content.announcements",
        "instanceId": "w-gdt-tile-4",
        "config": { "mode": "text", "text": "Tile 4 — metric or status." }
      },
      {
        "widgetId": "content.announcements",
        "instanceId": "w-gdt-tile-5",
        "config": { "mode": "text", "text": "Tile 5 — metric or status." }
      },
      {
        "widgetId": "content.announcements",
        "instanceId": "w-gdt-tile-6",
        "config": { "mode": "text", "text": "Tile 6 — metric or status." }
      }
    ]
  },
  "status": "draft",
  "meta": { "title": "Gallery — Dashboard Tiles", "slug": "/gallery/dashboard-tiles" }
}
