{
  "pageId": "gallery-hero-and-grid",
  "tenantId": "acme",
  "templateId": "template.hero-and-grid",
  "templateVersion": "0.1.0",
  "regions": {
    "hero": [
      {
        "widgetId": "content.announcements",
        "instanceId": "w-ghg-hero-1",
        "config": { "mode": "text", "text": "Hero — headline announcement." }
      }
    ],
    "grid": [
      {
        "widgetId": "content.announcements",
        "instanceId": "w-ghg-grid-1",
        "config": { "mode": "text", "text": "Grid — content card." }
      }
    ]
  },
  "status": "draft",
  "meta": { "title": "Gallery — Hero + Grid", "slug": "/gallery/hero-and-grid" }
}
